[
  {
    "id": "bl.e.chaos-sigil",
    "name": "CHAOS SIGIL",
    "scope": "faction",
    "team": "blooded",
    "count": 1,
    "text": "The Reward Earned ploy costs you 0 CP.",
    "source": "team-blooded.pdf (Apr '26); docs/spec/13-teams.md T-BL.44"
  },
  {
    "id": "bl.e.sinister-trophies",
    "name": "SINISTER TROPHIES",
    "scope": "faction",
    "team": "blooded",
    "count": 1,
    "text": "When an enemy operative shoots, fights or retaliates against a friendly token holder within 2 inches of it, that enemy cannot re-roll attack dice showing 1.",
    "source": "team-blooded.pdf (Apr '26); docs/spec/13-teams.md T-BL.45"
  },
  {
    "id": "bl.e.symbols-of-bloody-worship",
    "name": "SYMBOLS OF BLOODY WORSHIP",
    "scope": "faction",
    "team": "blooded",
    "count": 1,
    "text": "When a friendly Blooded operative ends an action without being incapacitated, having dealt damage to an enemy during it, it regains 1 lost wound.",
    "source": "team-blooded.pdf (Apr '26); docs/spec/13-teams.md T-BL.46"
  },
  {
    "id": "bl.e.wicked-blades",
    "name": "WICKED BLADES",
    "scope": "faction",
    "team": "blooded",
    "count": 1,
    "text": "The bayonet, Chieftain's bayonet, bayonet & shield and improvised blade of friendly Blooded operatives have +1 to both Dmg values for the battle.",
    "source": "team-blooded.pdf (Apr '26); docs/spec/13-teams.md T-BL.47"
  }
]
