[
  {
    "id": "cc.e.baleful-script",
    "name": "BALEFUL SCRIPT",
    "scope": "faction",
    "team": "chaos-cult",
    "count": 1,
    "window": "strategy.gambit",
    "limits": {
      "uses": 1,
      "per": "battle",
      "scope": "team"
    },
    "effect": {
      "code": "ccBalefulScript"
    },
    "text": "Once per battle, as a free strategic gambit, change one of your Accursed Gifts to one nobody has selected. If it was an operative's Abhorrent Mutation gift, only that operative changes.",
    "source": "team-chaos-cult.pdf (Jul '25); docs/spec/13-teams.md T-CC.37"
  },
  {
    "id": "cc.e.covert-guises",
    "name": "COVERT GUISES",
    "scope": "faction",
    "team": "chaos-cult",
    "count": 1,
    "window": "strategy.gambit",
    "effect": {
      "code": "ccCovertGuises"
    },
    "text": "When revealed, roll a D3. As a free strategic gambit in the first turning point, that many Devotees wholly in your drop zone may make a free Reposition that must end wholly within 3\" of it.",
    "source": "team-chaos-cult.pdf (Jul '25); docs/spec/13-teams.md T-CC.38"
  },
  {
    "id": "cc.e.unholy-talisman",
    "name": "UNHOLY TALISMAN",
    "scope": "faction",
    "team": "chaos-cult",
    "count": 1,
    "limits": {
      "uses": 1,
      "per": "turningPoint",
      "scope": "team"
    },
    "effect": {
      "code": "ccUnholyTalisman"
    },
    "text": "Once per turning point, when an operative shoots a friendly cult operative, retain one of your normal defence successes as a critical success instead.",
    "source": "team-chaos-cult.pdf (Jul '25); docs/spec/13-teams.md T-CC.39"
  },
  {
    "id": "cc.e.vile-blessing",
    "name": "VILE BLESSING",
    "scope": "faction",
    "team": "chaos-cult",
    "count": 1,
    "limits": {
      "uses": 1,
      "per": "battle",
      "scope": "team"
    },
    "effect": {
      "code": "ccVileBlessing"
    },
    "text": "Once per battle, when an attack die inflicts Normal Dmg on a friendly cult operative that is not a Devotee, ignore that damage. A Mutant or Torment uses either this or the Unnatural Regeneration roll on that die, not both.",
    "source": "team-chaos-cult.pdf (Jul '25); docs/spec/13-teams.md T-CC.40"
  }
]
